term,definition,question,incorrect answers
Ulna,"<p>The <b>ulna</b> is one of the two long bones in the <a href='/wiki/Forearm' title='Forearm'>forearm</a>, the other being the <a href='/wiki/Radius_(bone)' title='Radius (bone)'>radius</a>. It is <a href='/wiki/Prism_(geometry)' title='Prism (geometry)'>prismatic</a> in form and runs parallel to the radius, which is shorter and smaller. In anatomical position (i.e. when the arms are down at the sides of the body and the palms of the hands face forward) the ulna is located at the side of the forearm closest to the body (the <a href='/wiki/Anatomical_terms_of_location#Relative_directions' title='Anatomical terms of location'>medial</a> side), the side of the <a href='/wiki/Little_finger' title='Little finger'>little finger</a>. The corresponding bone in the <a href='/wiki/Human_leg' title='Human leg'>leg</a> is the <a href='/wiki/Fibula' title='Fibula'>fibula</a>.</p>","Which is one of the two long bones in the forearm, the other being the radius?",Ulna,Humerus,User:Dust.of.nations/Humorous,Acromion,Anatomical neck of humerus
Femur,"<p>The <b>femur</b> (pl. <i>femurs</i> or <i>femora</i>), or <b>thigh bone</b>, is the most <a href='/wiki/Anatomical_terms_of_location#Proximal_and_distal' title='Anatomical terms of location'>proximal</a> (closest to the center of the body) <a href='/wiki/Bone' title='Bone'>bone</a> of the <a href='/wiki/Leg' title='Leg'>leg</a> in <a href='/wiki/Tetrapod' title='Tetrapod'>tetrapod</a> <a href='/wiki/Vertebrate' title='Vertebrate'>vertebrates</a> capable of <a href='/wiki/Walking' title='Walking'>walking</a> or <a href='/wiki/Jumping' title='Jumping'>jumping</a>, such as most land <a href='/wiki/Mammal' title='Mammal'>mammals</a>, <a href='/wiki/Bird' title='Bird'>birds</a>, many <a href='/wiki/Reptile' title='Reptile'>reptiles</a> such as <a href='/wiki/Lizard' title='Lizard'>lizards</a>, and <a href='/wiki/Amphibian' title='Amphibian'>amphibians</a> such as <a href='/wiki/Frog' title='Frog'>frogs</a>. In vertebrates with four legs such as <a href='/wiki/Dog' title='Dog'>dogs</a> and <a href='/wiki/Horse' title='Horse'>horses</a>, the femur is found only in the rear legs. The femur is the largest bone in the body. The head of the femur articulates with the <a href='/wiki/Acetabulum' title='Acetabulum'>acetabulum</a>.</p>","Which is the most proximal  bone of the leg in tetrapod vertebrates capable of walking or jumping, such as most land mammals, birds, many reptiles such as lizards, and amphibians such as frogs?",Anterior intercondylar area,Ulna,Humerus,Acetabulum,User:Dust.of.nations/Humorous,Adductor tubercle of femur
Tibia,"<p>The <b>tibia</b> (<small>English pronunciation:</small> <span class='IPA' title='Pronunciation in IPA'><a href='/wiki/Wikipedia:IPA_for_English' title='Wikipedia:IPA for English'>/ˈtɪbɪə/</a></span>), <b>shinbone</b>, or <b>shankbone</b> is the larger and stronger of the two <a href='/wiki/Bone' title='Bone'>bones</a> in the <a href='/wiki/Leg' title='Leg'>leg</a> below the <a href='/wiki/Knee' title='Knee'>knee</a> in vertebrates (the other being the <a href='/wiki/Fibula' title='Fibula'>fibula</a>), and connects the knee with the ankle bones. The tibia is named for the Greek <a href='/wiki/Aulos' title='Aulos'>aulos</a> flute, also known as a tibia. It is commonly recognized as the strongest weight bearing bone in the body.</p>","Which is the larger and stronger of the two bones in the leg below the knee in vertebrates , and connects the knee with the ankle bones?",Anterior intercondylar area,Ulna,Humerus,Acetabulum,User:Dust.of.nations/Humorous,Adductor tubercle of femur
Fibula,"<p>The <b>fibula</b> or <b>calf bone</b> is a <a href='/wiki/Bone' title='Bone'>bone</a> located on the <a href='/wiki/Lateral_(anatomy)' class='mw-redirect' title='Lateral (anatomy)'>lateral</a> side of the <a href='/wiki/Tibia' title='Tibia'>tibia</a>, with which it is connected above and below. It is the smaller of the two bones, and, in proportion to its length, the most slender of all the long bones. Its upper extremity is small, placed toward the back of the head of the tibia, below the level of the <a href='/wiki/Knee' title='Knee'>knee-joint</a>, and excluded from the formation of this joint. Its lower extremity inclines a little forward, so as to be on a plane anterior to that of the upper end; it projects below the tibia, and forms the lateral part of the ankle-joint.</p>","Which is a bone located on the lateral side of the tibia, with which it is connected above and below?",Anterior intercondylar area,Ulna,Humerus,Acetabulum,User:Dust.of.nations/Humorous,Adductor tubercle of femur
Scapula,"<p>In <a href='/wiki/Anatomy' title='Anatomy'>anatomy</a>, the <b>scapula</b>, <b>omo</b> (Medical Latin), or <b>shoulder blade</b>, is the <a href='/wiki/Bone' title='Bone'>bone</a> that connects the <a href='/wiki/Humerus' title='Humerus'>humerus</a> (upper arm bone) with the <a href='/wiki/Clavicle' title='Clavicle'>clavicle</a> (collar bone).</p>",Which is the bone that connects the humerus  with the clavicle?,Ulna,Scapula,Skull roof,Acromion,Skull,Anatomical neck of humerus
Jaw,"<p>The <b>ulna</b> is one of the two long bones in the <a href='/wiki/Forearm' title='Forearm'>forearm</a>, the other being the <a href='/wiki/Radius_(bone)' title='Radius (bone)'>radius</a>. It is <a href='/wiki/Prism_(geometry)' title='Prism (geometry)'>prismatic</a> in form and runs parallel to the radius, which is shorter and smaller. In anatomical position (i.e. when the arms are down at the sides of the body and the palms of the hands face forward) the ulna is located at the side of the forearm closest to the body (the <a href='/wiki/Anatomical_terms_of_location#Relative_directions' title='Anatomical terms of location'>medial</a> side), the side of the <a href='/wiki/Little_finger' title='Little finger'>little finger</a>. The corresponding bone in the <a href='/wiki/Human_leg' title='Human leg'>leg</a> is the <a href='/wiki/Fibula' title='Fibula'>fibula</a>.</p>","Which is one of the two long bones in the forearm, the other being the radius?",Ulna,Humerus,User:Dust.of.nations/Humorous,Acromion,Anatomical neck of humerus
Mandible,"<p>The <b>ulna</b> is one of the two long bones in the <a href='/wiki/Forearm' title='Forearm'>forearm</a>, the other being the <a href='/wiki/Radius_(bone)' title='Radius (bone)'>radius</a>. It is <a href='/wiki/Prism_(geometry)' title='Prism (geometry)'>prismatic</a> in form and runs parallel to the radius, which is shorter and smaller. In anatomical position (i.e. when the arms are down at the sides of the body and the palms of the hands face forward) the ulna is located at the side of the forearm closest to the body (the <a href='/wiki/Anatomical_terms_of_location#Relative_directions' title='Anatomical terms of location'>medial</a> side), the side of the <a href='/wiki/Little_finger' title='Little finger'>little finger</a>. The corresponding bone in the <a href='/wiki/Human_leg' title='Human leg'>leg</a> is the <a href='/wiki/Fibula' title='Fibula'>fibula</a>.</p>","Which is one of the two long bones in the forearm, the other being the radius?",Ulna,Humerus,User:Dust.of.nations/Humorous,Acromion,Anatomical neck of humerus
